{
  "schema_version": 1,
  "timestamp": "2026-05-28T14:30:00Z",
  "mode": "implementation",
  "canon": {
    "available": true,
    "version": "0.61.0",
    "initialized": true,
    "error": null
  },
  "workspace": {
    "path": "/path/to/repo",
    "git_branch": "main",
    "git_user": "developer@example.com",
    "error": null
  },
  "input": {
    "file_exists": false,
    "file_path": "canon-input/implementation.md",
    "file_empty": null,
    "folder_exists": false,
    "folder_path": "canon-input/implementation/",
    "folder_empty": null,
    "resolved_path": null,
    "ambiguous": false,
    "error": null
  },
  "runs": {
    "active": 0,
    "pending_approvals": 0,
    "error": null
  }
}
