{
  "schema_version": 1,
  "timestamp": "2026-05-28T14:30:00Z",
  "mode": "implementation",
  "canon": {
    "available": false,
    "version": null,
    "initialized": false,
    "error": "canon binary not found on PATH"
  },
  "workspace": {
    "path": "/path/to/repo",
    "git_branch": "main",
    "git_user": "developer@example.com",
    "error": null
  },
  "input": {
    "file_exists": true,
    "file_path": "canon-input/implementation.md",
    "file_empty": false,
    "folder_exists": false,
    "folder_path": "canon-input/implementation/",
    "folder_empty": null,
    "resolved_path": "canon-input/implementation.md",
    "ambiguous": false,
    "error": null
  },
  "runs": {
    "active": null,
    "pending_approvals": null,
    "error": "canon not available; cannot query runs"
  }
}
